{
  "$schema": "https://roya-trading.com/api/registry.schema.json",
  "version": "1.3",
  "name": "Roya Trading — Crypto Prop Firm Registry",
  "license": "https://creativecommons.org/licenses/by/4.0/",
  "attribution": "CC-BY 4.0 — cite \"Roya Trading\" with a link to https://roya-trading.com/",
  "generatedAt": "2026-09-25",
  "gridLastReviewed": "2026-09-10",
  "statusLastVerified": "2026-09-25",
  "source": "https://roya-trading.com/prop-firm-graveyard/",
  "methodology": "https://roya-trading.com/how-we-test-prop-firms/",
  "detectionMethodology": "https://roya-trading.com/prop-firm-graveyard/methodology/",
  "changelogUrl": "https://roya-trading.com/prop-firm-graveyard/changelog/",
  "counter": {
    "goneDarkSince": "2026-06",
    "goneDark": 1,
    "tracked": 10,
    "asOf": "2026-09-25",
    "permalink": "https://roya-trading.com/prop-firm-graveyard/#count"
  },
  "verifiedPayouts": {
    "asOf": "2026-09-19",
    "reconciledTotal": 54,
    "propr": {
      "count": 48,
      "usdc": 7670.94,
      "chain": "ethereum",
      "firstIso": "2026-05-20",
      "lastIso": "2026-09-18"
    },
    "hypernova": {
      "count": 6,
      "usdc": 1932.09,
      "chain": "arbitrum",
      "firstIso": "2026-08-29",
      "lastIso": "2026-09-01",
      "splitPct": 80
    },
    "methodology": "https://roya-trading.com/payouts/",
    "dataset": "https://roya-trading.com/api/payouts.json",
    "datasetCsv": "https://roya-trading.com/api/payouts.csv"
  },
  "hypernovaReserve": {
    "usd": 604038.65,
    "iso": "2026-09-25",
    "chain": "arbitrum",
    "block": 508755865,
    "tracker": "https://roya-trading.com/hypernova-reserve-tracker/"
  },
  "firms": [
    {
      "canonicalName": "Propr.xyz",
      "slug": "propr",
      "aliases": [
        "Propr",
        "PROPR",
        "propr xyz",
        "Propr Trading"
      ],
      "officialUrl": "https://www.propr.xyz/",
      "rails": "Hyperliquid",
      "status": "active",
      "trustScore": 86.7,
      "onChainTier": 3,
      "traded": true,
      "identifier": {
        "label": "Payout Distributor",
        "address": "0x6e810d5c33a4355ce1b4107f5722787bfd7acf24",
        "chain": "ethereum",
        "explorer": "https://etherscan.io/address/0x6e810d5c33a4355ce1b4107f5722787bfd7acf24"
      },
      "review": "https://roya-trading.com/prop-firms/propr/",
      "reviewReadIso": "2026-09-05",
      "priceFrom": "$25",
      "payoutsVerifiedByUs": 48,
      "boughtByUs": true,
      "cap": null
    },
    {
      "canonicalName": "Hypernova",
      "slug": "hypernova",
      "aliases": [
        "Hypernova Trading",
        "hypernova.xyz"
      ],
      "officialUrl": "https://hypernova.xyz/",
      "rails": "Hyperliquid",
      "status": "active",
      "trustScore": 85.7,
      "onChainTier": 4,
      "traded": true,
      "identifier": {
        "label": "Vault",
        "address": "0x920973eebffd3bf7da14dd9fb52bd3bea1664c67",
        "chain": "arbitrum",
        "explorer": "https://arbiscan.io/address/0x920973eebffd3bf7da14dd9fb52bd3bea1664c67"
      },
      "review": "https://roya-trading.com/prop-firms/hypernova/",
      "reviewReadIso": "2026-09-05",
      "priceFrom": "$25",
      "payoutsVerifiedByUs": 6,
      "boughtByUs": true,
      "cap": null
    },
    {
      "canonicalName": "Carrot Funding",
      "slug": "carrot-funding",
      "aliases": [
        "Carrot",
        "carrotfunding.io"
      ],
      "officialUrl": "https://carrotfunding.io/",
      "rails": "Arbitrum",
      "status": "active",
      "trustScore": 73.2,
      "onChainTier": null,
      "traded": true,
      "identifier": null,
      "review": "https://roya-trading.com/prop-firms/carrot-funding/",
      "reviewReadIso": "2026-09-11",
      "priceFrom": "$65 (2-Phase $5K — the one we bought, 10 Sep 2026)",
      "payoutsVerifiedByUs": 0,
      "boughtByUs": true,
      "cap": null
    },
    {
      "canonicalName": "Solana Funded",
      "slug": "solana-funded",
      "aliases": [
        "SolanaFunded",
        "solanafunded.com"
      ],
      "officialUrl": "https://solanafunded.com/",
      "rails": "Solana",
      "status": "active",
      "trustScore": 69.8,
      "onChainTier": null,
      "traded": false,
      "identifier": null,
      "review": "https://roya-trading.com/prop-firms/solana-funded/",
      "reviewReadIso": "2026-09-05",
      "priceFrom": "$61.60 (2.5K, SF30 promo) — list $88",
      "payoutsVerifiedByUs": 0,
      "boughtByUs": false,
      "cap": 85
    },
    {
      "canonicalName": "Breakout",
      "slug": "breakout",
      "aliases": [
        "Breakout Prop",
        "breakoutprop.com"
      ],
      "officialUrl": "https://www.breakoutprop.com/",
      "rails": "Centralized (Kraken-owned)",
      "status": "active",
      "trustScore": 69.5,
      "onChainTier": null,
      "traded": false,
      "identifier": null,
      "review": "https://roya-trading.com/prop-firms/breakout/",
      "reviewReadIso": "2026-09-05",
      "priceFrom": "$40 (5K Turbo)",
      "payoutsVerifiedByUs": 0,
      "boughtByUs": false,
      "cap": 85
    },
    {
      "canonicalName": "HyperPNL",
      "slug": "hyperpnl",
      "aliases": [
        "Hyper PNL",
        "hyperpnl.com"
      ],
      "officialUrl": "https://hyperpnl.com/",
      "rails": "Hyperliquid",
      "status": "active",
      "trustScore": 64.5,
      "onChainTier": null,
      "traded": true,
      "identifier": null,
      "review": "https://roya-trading.com/prop-firms/hyperpnl/",
      "reviewReadIso": "2026-09-09",
      "priceFrom": "$42 (1-Step Flex $5K — the one we bought, 9 Sep 2026)",
      "payoutsVerifiedByUs": 0,
      "boughtByUs": true,
      "cap": null
    },
    {
      "canonicalName": "GT Funded",
      "slug": "gt-funded",
      "aliases": [
        "GTFunded",
        "GT Funded relaunch"
      ],
      "officialUrl": null,
      "rails": "On-chain (historical)",
      "status": "relaunching",
      "trustScore": 18.3,
      "onChainTier": null,
      "traded": false,
      "identifier": null,
      "review": "https://roya-trading.com/prop-firms/gt-funded/",
      "reviewReadIso": "2026-09-05",
      "priceFrom": "$99 (10K, waitlist — not purchasable)",
      "payoutsVerifiedByUs": 0,
      "boughtByUs": false,
      "cap": 85
    }
  ],
  "trackedNotScored": [
    {
      "name": "DojiFunded",
      "slug": "dojifunded",
      "url": "https://roya-trading.com/prop-firms/dojifunded/",
      "officialUrl": "https://dojifunded.com/",
      "status": "active",
      "statusLabel": "Live — not scored",
      "lastCheckedIso": "2026-09-15",
      "whyNotScored": "Not bought, not traded by us; no payout of ours to reconcile. On 13 September 2026 our on-chain grid gate held it (contract address published, product not yet lived); the docs became readable on 15 September 2026.",
      "facts": [
        "Four account types from $1K to $100K: Instant Funding (soon), 1-Step (10 % target, 6 % static max drawdown, 3 % daily), 2-Step Classic (5 % then 10 %, 6 % / 3 %), 2-Step Elite (8 % / 5 %) — docs.dojifunded.com, read 15 Sep 2026.",
        "Execution routes through GMX and Ostium, isolated margin only, leverage 5x crypto · 10x indices · 15x forex; copy trading not allowed; no time limit, no minimum trading days — read 15 Sep 2026.",
        "An 80 % / 90 % profit-split add-on costs +20 % of the base price; homepage claims “up to $100K funding, on-chain verification, instant payouts” — claims, not verified by us, read 15 Sep 2026."
      ]
    },
    {
      "name": "PropMarket",
      "slug": "propmarket",
      "url": "https://roya-trading.com/prop-firms/propmarket/",
      "officialUrl": "https://prop.market/",
      "status": "active",
      "statusLabel": "Live — not scored (prediction markets)",
      "lastCheckedIso": "2026-09-15",
      "whyNotScored": "Prediction-market prop firm (Polymarket, Kalshi), outside our crypto-perps grid; not bought by us.",
      "facts": [
        "One-step evaluation from $59 one-time, account sizes $5K to $250K, 70/30 split (90 % sold as an add-on), 20 % profit target, 10 % trailing-equity max drawdown, 30-day time limit — prop.market pricing, read 15 Sep 2026.",
        "Rules read 15 Sep 2026: markets must resolve within 60 days, price range 20–80 cents only, no single market above 10 % of total profit, first withdrawal after 7 days then every 7 days, 2 % minimum payout.",
        "Kalshi support announced on the homepage with a 25 % promo code on 15 Sep 2026; the $250K tier was an early-access waitlist at our 10 Aug 2026 registry read."
      ]
    },
    {
      "name": "PolyFunded",
      "slug": "polyfunded",
      "url": "https://roya-trading.com/prop-firms/polyfunded/",
      "officialUrl": "https://polyfunded.xyz/",
      "status": "active",
      "statusLabel": "Live — not scored",
      "lastCheckedIso": "2026-09-15",
      "whyNotScored": "Not bought, not traded; its “on-chain verified payouts” claim has not been checked by us against a published address.",
      "facts": [
        "Evaluations from $35, account sizes $5K to $200K, 40+ crypto pairs priced on Binance data plus a Polymarket simulation mode; profit target 10–15 %, minimum 10 trading days, no time limit — homepage read 15 Sep 2026.",
        "Split advertised as 100 % of the first $5K profit then 90 %, bi-weekly USDC payouts, scaling to 2.5x — advertised, not verified, read 15 Sep 2026.",
        "Registry read 10 Aug 2026: HTTP 307 → 200, its own FAQ calls the Polymarket side “simulation trading”."
      ]
    },
    {
      "name": "Vanta Trading",
      "slug": "vanta-trading",
      "url": "https://roya-trading.com/prop-firms/vanta-trading/",
      "officialUrl": "https://vantatrading.io/",
      "status": "simulated",
      "statusLabel": "Simulated platform — not a funded account",
      "lastCheckedIso": "2026-09-15",